{
  "catalog_version": "1",
  "protocol_version": "2.1-candidate",
  "status": "candidate-working-draft",
  "normative": false,
  "assertions": [
    {
      "id": "A402-CAND-001",
      "status": "candidate",
      "source": "../a402-binding.md#1-独立性",
      "applies_to": [
        "INS/L1",
        "DEL/L2",
        "AUP/L3"
      ],
      "statement": "A402 is a reusable payment interaction capability and is not owned by a single ACT layer.",
      "test_level": "documentation",
      "preconditions": [
        "An ACT payment scenario has been selected."
      ],
      "inputs": [
        "The scenario identifier and selected payment access protocol."
      ],
      "expected_output": [
        "INS/L1, DEL/L2, and AUP/L3 can each reference A402 without changing their authorization semantics."
      ],
    "executable_check": "scripts/check_repository.py#A402-CAND-001",
      "pending_decision": null
    },
    {
      "id": "A402-CAND-002",
      "status": "candidate",
      "source": "../a402-binding.md#3-候选交互",
      "applies_to": [
        "HTTP binding",
        "resource server"
      ],
      "statement": "When acceptable payment proof is absent, the resource server returns HTTP 402 with Payment-Needed.",
      "test_level": "integration",
      "preconditions": [
        "The requested resource requires payment.",
        "The request has no acceptable Payment-Proof."
      ],
      "inputs": [
        "An HTTP request for the protected resource without Payment-Proof."
      ],
      "expected_output": [
        "The HTTP response status is 402.",
        "The response contains Payment-Needed."
      ],
      "executable_check": "quickstarts/alipay/end-to-end-402/local-preview.test.mjs#A402-CAND-002",
      "pending_decision": null
    },
    {
      "id": "A402-CAND-003",
      "status": "candidate",
      "source": "../a402-binding.md#7-proof-验证防重放与一致性",
      "applies_to": [
        "resource server"
      ],
      "statement": "Payment-Proof is untrusted input until it has been validated.",
      "test_level": "integration",
      "preconditions": [
        "A request supplies Payment-Proof.",
        "No authoritative validation result exists."
      ],
      "inputs": [
        "An arbitrary or malformed Payment-Proof."
      ],
      "expected_output": [
        "The protected resource is not delivered solely because proof was supplied."
      ],
      "executable_check": "quickstarts/alipay/end-to-end-402/local-preview.test.mjs#A402-CAND-003",
      "pending_decision": null
    },
    {
      "id": "A402-CAND-004",
      "status": "candidate",
      "source": "../a402-binding.md#7-proof-验证防重放与一致性",
      "applies_to": [
        "resource server",
        "payment service"
      ],
      "statement": "Validation covers authenticity, expiry, replay resistance, and consistency with the original request before protected delivery.",
      "test_level": "end-to-end",
      "preconditions": [
        "A Product Profile defines an authoritative proof validation mechanism."
      ],
      "inputs": [
        "Payment-Proof, the original payment requirement, and the retried resource request."
      ],
      "expected_output": [
        "Delivery occurs only after all profile-required authenticity, expiry, replay, and consistency checks pass."
      ],
      "executable_check": "scripts/validate_a402_contract.py#A402-CAND-004",
      "pending_decision": null
    },
    {
      "id": "A402-CAND-005",
      "status": "candidate",
      "source": "../a402-binding.md#3-候选交互",
      "applies_to": [
        "resource server",
        "delivery"
      ],
      "statement": "Payment success alone is not evidence that delivery or fulfillment succeeded.",
      "test_level": "end-to-end",
      "preconditions": [
        "An authoritative payment result reports success."
      ],
      "inputs": [
        "Payment result, resource delivery result, and fulfillment confirmation result."
      ],
      "expected_output": [
        "Payment, delivery, and fulfillment remain separately observable outcomes."
      ],
      "executable_check": "scripts/validate_a402_contract.py#A402-CAND-005",
      "pending_decision": null
    },
    {
      "id": "A402-CAND-006",
      "status": "candidate",
      "source": "../a402-binding.md#6-原请求重试",
      "applies_to": [
        "buyer",
        "resource server"
      ],
      "statement": "A request retried with payment proof remains associated with the original resource or service request.",
      "test_level": "integration",
      "preconditions": [
        "A buyer obtained proof for a specific payment requirement."
      ],
      "inputs": [
        "Original request context, payment requirement, proof, and retried request."
      ],
      "expected_output": [
        "The proof cannot be silently reassigned to another resource, service, or order."
      ],
      "executable_check": "scripts/validate_a402_contract.py#A402-CAND-006",
      "pending_decision": null
    },
    {
      "id": "A402-CAND-007",
      "status": "candidate",
      "source": "../a402-binding.md#9-幂等与错误恢复",
      "applies_to": [
        "resource server",
        "delivery"
      ],
      "statement": "Repeated proof or request submission cannot cause duplicate non-idempotent delivery.",
      "test_level": "end-to-end",
      "preconditions": [
        "A proof or retried request is submitted more than once."
      ],
      "inputs": [
        "Repeated or concurrent submissions associated with the same payment."
      ],
      "expected_output": [
        "The implementation returns a stored result or rejects replay without repeating non-idempotent delivery."
      ],
      "executable_check": "quickstarts/alipay/metered-rest-provider/src/test/java/org/actprotocol/quickstart/alipay/PaidResourceServerTest.java#A402-CAND-007",
      "pending_decision": null
    },
    {
      "id": "A402-CAND-008",
      "status": "candidate",
      "source": "../a402-binding.md#9-幂等与错误恢复",
      "applies_to": [
        "buyer",
        "resource server",
        "payment service"
      ],
      "statement": "Error recovery distinguishes payment failure, validation failure, delivery failure, and unknown outcome.",
      "test_level": "end-to-end",
      "preconditions": [
        "The interaction does not complete its full happy path."
      ],
      "inputs": [
        "Observed payment, validation, delivery, and fulfillment outcomes."
      ],
      "expected_output": [
        "The result identifies the failed or unknown phase without claiming later phases succeeded."
      ],
      "executable_check": "scripts/validate_a402_contract.py#A402-CAND-008",
      "pending_decision": null
    },
  {
    "id": "PSD-CAND-001",
      "status": "candidate",
      "source": "../payment-services-domain-spec.md#2-组件总览",
      "applies_to": [
        "PSD Core",
        "Product Profile"
      ],
      "statement": "The PSD Candidate contains payment binding, agent sub-account, INS/L1, DEL/L2, AUP/L3, and A402 as six distinct components.",
      "test_level": "documentation",
      "preconditions": [
        "An implementation or Product Profile declares coverage of the ACT 2.1 PSD Candidate."
      ],
      "inputs": [
        "The declared PSD component inventory."
      ],
      "expected_output": [
        "The declaration uses only the six Candidate components and does not merge A402 into AUP."
      ],
    "executable_check": "scripts/check_repository.py#PSD-CAND-001",
      "pending_decision": null
    },
    {
      "id": "PSD-CAND-002",
      "status": "candidate",
      "source": "../payment-services-domain-spec.md#4-psd-pmt-bnd支付方式绑定",
      "applies_to": [
        "PSD-PMT-BND",
        "buyer payment tool"
      ],
      "statement": "A buyer agent uses a restricted payment-tool reference and does not receive the principal's raw payment-account credentials.",
      "test_level": "integration",
      "preconditions": [
        "A payment tool is prepared for an agent."
      ],
      "inputs": [
        "The binding result exposed to the agent."
      ],
      "expected_output": [
        "The result is a restricted reference whose status and agent binding can be checked by the account service or PSP."
      ],
      "executable_check": null,
      "pending_decision": "The cross-product binding message shape remains undecided."
    },
    {
      "id": "PSD-CAND-003",
      "status": "candidate",
      "source": "../payment-services-domain-spec.md#6-psd-pay-ins即时支付-l1",
      "applies_to": [
        "PSD-PAY-INS",
        "L1"
      ],
      "statement": "INS/L1 requires user confirmation for the individual transaction before the PSP moves or reserves funds.",
      "test_level": "end-to-end",
      "preconditions": [
        "The selected payment scenario is INS/L1."
      ],
      "inputs": [
        "The payment request, PSP validation result, and user-confirmation result."
      ],
      "expected_output": [
        "Funds are not moved or reserved when the individual user confirmation is absent, cancelled, failed, or expired."
      ],
      "executable_check": null,
      "pending_decision": null
    },
    {
      "id": "PSD-CAND-004",
      "status": "candidate",
      "source": "../payment-services-domain-spec.md#7-psd-pay-del定向委托支付-l2",
      "applies_to": [
        "PSD-PAY-DEL",
        "L2"
      ],
      "statement": "DEL/L2 requires both agent-side preflight and authoritative PSP validation of the IAC and financial boundaries.",
      "test_level": "end-to-end",
      "preconditions": [
        "The selected payment scenario is DEL/L2."
      ],
      "inputs": [
        "The IAC, payment request, local accumulated amount, and authoritative PSP history."
      ],
      "expected_output": [
        "A locally accepted request is still rejected when authoritative IAC, amount, merchant, method, identity, or account checks fail."
      ],
      "executable_check": null,